{
  "$schema": "https://fractal.local/schemas/apple-principles-registry.schema.json",
  "record_type": "apple-principles-registry",
  "record_version": 1,
  "continuous_improvement_is_core": true,
  "acceptance_layer_only": true,
  "library": {
    "catalogue_title": "Apple Guide Catalogue",
    "index_version": 2,
    "index_updated": "2026-08-21",
    "index_label": "Apple/INDEX.json",
    "index_sha256": "94b10ebc13cbb5dd7542487e8a232b315c191b6fc2e801f15cec5081c502d1d1",
    "hig_source_count": 171,
    "source_manifest_sha256": "40308dfd08e1c7ad3acdf05b659463b1984c69f7dbff96d2c752de0f169bec1c",
    "applicability_counts": {
      "universal": 12,
      "conditional": 109,
      "not-current": 50
    },
    "source_variant_counts": {
      "current-(2)": 143,
      "indexed-only": 28
    }
  },
  "principles": [
    {
      "principle_id": "purpose",
      "title": "Purpose",
      "source_refs": [
        "hig:design-principles"
      ],
      "acceptance": "The responsibility has a meaningful user outcome and stays focused on the problem it exists to solve.",
      "continuous_improvement_reinforcement": "Improvement is accepted only when it advances the responsibility purpose."
    },
    {
      "principle_id": "agency",
      "title": "Agency",
      "source_refs": [
        "hig:design-principles"
      ],
      "acceptance": "People remain informed and in control, can choose how to proceed, and can recover from mistakes.",
      "continuous_improvement_reinforcement": "Improvement preserves user authority, recovery, and explicit persistent-change boundaries."
    },
    {
      "principle_id": "responsibility",
      "title": "Responsibility",
      "source_refs": [
        "hig:design-principles"
      ],
      "acceptance": "The responsibility acts in people’s best interests with safety, privacy, transparency, and data minimisation.",
      "continuous_improvement_reinforcement": "Improvement evidence must prove benefit without weakening safety, privacy, or trust."
    },
    {
      "principle_id": "familiarity",
      "title": "Familiarity",
      "source_refs": [
        "hig:design-principles"
      ],
      "acceptance": "The responsibility uses consistent concepts, clear feedback, and established Fractal language.",
      "continuous_improvement_reinforcement": "Improvement extends maintained concepts instead of creating needless parallel systems."
    },
    {
      "principle_id": "flexibility",
      "title": "Flexibility",
      "source_refs": [
        "hig:design-principles"
      ],
      "acceptance": "The responsibility works across relevant people, contexts, access needs, inputs, and platforms while preserving context.",
      "continuous_improvement_reinforcement": "Improvement is tested against diverse real conditions and does not narrow supported access."
    },
    {
      "principle_id": "simplicity",
      "title": "Simplicity",
      "source_refs": [
        "hig:design-principles"
      ],
      "acceptance": "The responsibility is clear, direct, concise, and hierarchically organised, including only what the job needs.",
      "continuous_improvement_reinforcement": "Improvement removes avoidable burden while retaining necessary evidence and control."
    },
    {
      "principle_id": "craft",
      "title": "Craft",
      "source_refs": [
        "hig:design-principles"
      ],
      "acceptance": "The responsibility demonstrates quality in details, real-world testing, iteration, reliability, and maintenance after release.",
      "continuous_improvement_reinforcement": "Craft makes evidence-led iteration and ongoing maintenance inseparable from completion."
    },
    {
      "principle_id": "delight",
      "title": "Delight",
      "source_refs": [
        "hig:design-principles"
      ],
      "acceptance": "The complete experience creates a purposeful human moment rather than superficial decoration.",
      "continuous_improvement_reinforcement": "Improvement must preserve purposeful human value and receive qualitative human acceptance."
    }
  ],
  "cross_cutting_requirements": [
    {
      "requirement_id": "generative-ai",
      "title": "Generative AI",
      "source_refs": [
        "hig:generative-ai"
      ],
      "acceptance": "AI behavior is transparent, controllable, bounded, recoverable, and evaluated for useful output and foreseeable harm.",
      "continuous_improvement_reinforcement": "AI is an instrument of evidenced Continuous Improvement and never substitutes for user authority or System Review.",
      "must_reinforce_continuous_improvement": true
    },
    {
      "requirement_id": "accessibility",
      "title": "Accessibility",
      "source_refs": [
        "hig:accessibility"
      ],
      "acceptance": "The responsibility is perceivable, understandable, adaptable, and operable through every relevant access modality from the start.",
      "continuous_improvement_reinforcement": "Each review checks that improvements preserve or expand effective access."
    },
    {
      "requirement_id": "inclusion",
      "title": "Inclusion",
      "source_refs": [
        "hig:inclusion"
      ],
      "acceptance": "Language, assumptions, defaults, and evaluation account for diverse people and contexts without stereotyping or exclusion.",
      "continuous_improvement_reinforcement": "Reality checks include affected perspectives and use findings to correct exclusion."
    },
    {
      "requirement_id": "privacy",
      "title": "Privacy",
      "source_refs": [
        "hig:privacy"
      ],
      "acceptance": "Collect, retain, expose, and transmit only necessary data with clear purpose, protection, consent, and control.",
      "continuous_improvement_reinforcement": "Improvement evidence cannot be purchased by expanding data access beyond the job."
    },
    {
      "requirement_id": "writing",
      "title": "Writing",
      "source_refs": [
        "hig:writing"
      ],
      "acceptance": "User-facing language is clear, conversational, concise, consistent, actionable, and written for people rather than internal architecture.",
      "continuous_improvement_reinforcement": "Reviews treat comprehension failures as product evidence and correct the maintained language."
    },
    {
      "requirement_id": "feedback",
      "title": "Feedback and status",
      "source_refs": [
        "hig:feedback",
        "hig:status"
      ],
      "acceptance": "Every consequential action communicates state, result, errors, and the next available action at the right time.",
      "continuous_improvement_reinforcement": "Observable outcomes make success and failure usable as review evidence."
    },
    {
      "requirement_id": "undo-and-recovery",
      "title": "Undo and recovery",
      "source_refs": [
        "hig:undo-and-redo"
      ],
      "acceptance": "People can cancel, undo, restore, or safely recover from mistakes and interrupted work in proportion to risk.",
      "continuous_improvement_reinforcement": "Experiments and corrections retain a tested restoration path."
    },
    {
      "requirement_id": "loading-and-progress",
      "title": "Loading and progress",
      "source_refs": [
        "hig:loading"
      ],
      "acceptance": "Waiting work is responsive, bounded where possible, honest about progress, and never presented as complete before evidence exists.",
      "continuous_improvement_reinforcement": "Latency and stalled progress are measured evidence for the next improvement."
    },
    {
      "requirement_id": "offering-help",
      "title": "Offering help",
      "source_refs": [
        "hig:offering-help"
      ],
      "acceptance": "Contextual help appears where a person needs it, explains the next action, and does not compensate for an avoidably unclear primary path.",
      "continuous_improvement_reinforcement": "Repeated help needs feed Perspective and System Review rather than becoming permanent friction."
    },
    {
      "requirement_id": "continuous-improvement-core",
      "title": "Continuous Improvement core",
      "source_refs": [
        "hig:design-principles",
        "hig:foundations"
      ],
      "acceptance": "Apple alignment operates only as System Review acceptance; Perspective and System Review remain the single continuous-improvement path and no parallel lifecycle is created.",
      "continuous_improvement_reinforcement": "Purpose, evidence-led iteration, real-world testing, and maintenance strengthen the existing Fractal core."
    }
  ],
  "sources": [
    {
      "source_id": "hig:accessibility",
      "title": "Accessibility",
      "category": "Design",
      "indexed_label": "Apple/Design/HIG - Accessibility.txt",
      "source_label": "Apple/Design/HIG - Accessibility (2).txt",
      "source_variant": "current-(2)",
      "official_url": "https://developer.apple.com/design/human-interface-guidelines/accessibility",
      "sha256": "fdb349c39b36a8091adc829f3e6362741eee47213df187314e5995c35cec65cc",
      "applicability": "universal",
      "applicability_rule": "Applies to every persistent Fractal responsibility."
    },
    {
      "source_id": "hig:action-button",
      "title": "Action button",
      "category": "Design",
      "indexed_label": "Apple/Design/HIG - Action button.txt",
      "source_label": "Apple/Design/HIG - Action button (2).txt",
      "source_variant": "current-(2)",
      "official_url": "https://developer.apple.com/design/human-interface-guidelines/action-button",
      "sha256": "1e231f1a1a261183d520b4873b399dca3ed378f6e1dc196626cccff8a0f61e86",
      "applicability": "not-current",
      "applicability_rule": "Not used by the current Fractal System or Workplace; reassess before introducing Action button."
    },
    {
      "source_id": "hig:action-sheets",
      "title": "Action sheets",
      "category": "Design",
      "indexed_label": "Apple/Design/HIG - Action sheets.txt",
      "source_label": "Apple/Design/HIG - Action sheets (2).txt",